id,name,address,district,price,rating,lat,lon,tags
158,Phở Vui,25 Hàng Giầy - Hoàn Kiếm,Hà Nội,55000,4.3,21.0350,105.8500,"Hà Nội, Miền Bắc, Phở, Bò Tái Lăn, Vỉa hè"
159,Phở Cường,23 Hàng Muối - Hoàn Kiếm,Hà Nội,50000,4.4,21.0360,105.8540,"Hà Nội, Miền Bắc, Phở, Bò Lõi Rùa, Sáng Nhanh"
160,Phở Bưng,1 Hàng Trống - Hoàn Kiếm,Hà Nội,40000,4.2,21.0280,105.8490,"Hà Nội, Miền Bắc, Phở, Bò, Vỉa hè Bưng bê"
161,Cơm Tấm Cali,32 Nguyễn Trãi - Quận 1,TPHCM,85000,4.1,10.7700,106.6900,"TPHCM, Miền Nam, Cơm tấm, Sườn Bì Chả, Chuỗi Văn phòng"
162,Cơm Tấm Phúc Lộc Thọ,236 Đinh Tiên Hoàng - Quận 1,TPHCM,55000,4.3,10.7900,106.6950,"TPHCM, Miền Nam, Cơm tấm, Sườn nướng, Chuỗi Sạch sẽ"
163,Cơm Tấm Thuận Kiều,46 Tôn Thất Tùng - Quận 1,TPHCM,90000,4.0,10.7850,106.6920,"TPHCM, Miền Nam, Cơm tấm, Sườn to, Lâu đời"
164,Cơm Tấm Mộc,85 Lý Tự Trọng - Quận 1,TPHCM,75000,4.4,10.7760,106.6980,"TPHCM, Miền Nam, Cơm tấm, Sườn que, Máy lạnh Văn phòng"
165,Cơm Tấm Sà Bì Chưởng,179 Trần Bình Trọng - Quận 5,TPHCM,80000,4.5,10.7580,106.6750,"TPHCM, Miền Nam, Cơm tấm, Sườn Cốt lết, Hot trend"
166,Cơm Tấm Ali,304 Kim Ngưu - Hai Bà Trưng,Hà Nội,60000,4.3,21.0050,105.8600,"Hà Nội, Miền Nam, Cơm tấm, Sườn nướng Bì, Cần thơ"
167,Cơm Tấm Tường Hân,70 Dịch Vọng Hậu - Cầu Giấy,Hà Nội,70000,4.2,21.0350,105.7850,"Hà Nội, Miền Nam, Cơm tấm, Sườn Khìa, Văn phòng"
168,Cơm Tấm 36,11 Phùng Hưng - Hoàn Kiếm,Hà Nội,55000,4.1,21.0400,105.8480,"Hà Nội, Miền Nam, Cơm tấm, Sườn Chả trứng, Phố cổ"
169,Cơm Tấm Tư Lùn,269 Kim Mã - Ba Đình,Hà Nội,65000,4.0,21.0320,105.8200,"Hà Nội, Miền Nam, Cơm tấm, Sườn Bì, Bình dân"
170,Cơm Tấm Kiều Ký,31A Lê Văn Hưu - Hai Bà Trưng,Hà Nội,60000,4.2,21.0180,105.8520,"Hà Nội, Miền Nam, Cơm tấm, Sườn Cây, Trưa"