id,name,address,district,price,rating,lat,lon,tags
1,Bún Bò Huế O Xinh,22 Nguyễn Hữu Cầu - Tân Định,TPHCM,55000,4.5,10.7915,106.6915,"TPHCM, Miền Trung, Bún bò, Cay Bò, Vỉa hè Bình dân"
2,Phở Tàu Bay,433 Lý Thái Tổ - Quận 10,TPHCM,60000,4.3,10.7712,106.6890,"TPHCM, Miền Bắc, Phở, Bò, Truyền thống Sáng"
3,Cơm Tấm Ba Ghiền,84 Đặng Văn Ngữ - Phú Nhuận,TPHCM,70000,4.1,10.7968,106.6750,"TPHCM, Miền Nam, Cơm tấm, Sườn Nướng Mỡ hành, Đêm Bình dân"
4,Pizza 4P's Hai Bà Trưng,151B Hai Bà Trưng - Quận 3,TPHCM,250000,4.9,10.7805,106.6980,"TPHCM, Âu, Pizza, Phô mai Ý, Sang trọng Hẹn hò"
5,Bánh Xèo Đinh Công Tráng,46A Đinh Công Tráng - Quận 1,TPHCM,40000,4.2,10.7890,106.6910,"TPHCM, Miền Nam, Bánh xèo, Tôm Thịt Giòn, Vỉa hè Truyền thống"
6,Hum Vegetarian,32 Võ Văn Tần - Quận 3,TPHCM,180000,4.7,10.7780,106.7030,"TPHCM, Á, Chay, Rau củ Nấm, Yên tĩnh Sang trọng"
7,Gà Rán Popeyes,62 Nguyễn Đức Cảnh - Quận 7,TPHCM,80000,4.0,10.7720,106.6700,"TPHCM, Âu, Gà rán, Gà Giòn Cay, Nhanh Ăn vặt"
8,Mì Quảng Ba Mua,193 Cách Mạng Tháng 8 - Quận 3,TPHCM,50000,4.4,10.7990,106.6550,"TPHCM, Miền Trung, Mì quảng, Gà Tôm Thịt, Bình dân Trưa"
9,Bún Đậu Mẹt,14 Đồng Nai - Quận 10,TPHCM,90000,4.1,10.7750,106.7000,"TPHCM, Miền Bắc, Bún đậu, Mắm tôm Thịt luộc, Vỉa hè Bạn bè"
10,Tokbokki Goobne,99 Nguyễn Thị Thập - Quận 7,TPHCM,120000,4.3,10.7300,106.7100,"TPHCM, Hàn Quốc, Tokbokki, Cay Phô mai, Bạn bè"
11,Bún Chả Hà Nội (Huỳnh Thúc K),18 Huỳnh Thúc Kháng - Quận 1,TPHCM,60000,4.2,10.7730,106.7010,"TPHCM, Miền Bắc, Bún chả, Nướng Thịt, Trưa Văn phòng"
12,Ốc Đào,212B Nguyễn Trãi - Quận 1,TPHCM,150000,4.0,10.7690,106.6950,"TPHCM, Miền Nam, Ốc, Hải sản Cay Bơ tỏi, Vỉa hè Nhậu Đêm"
13,Sushi Hokkaido Sachi,139 Nguyễn Trãi - Quận 1,TPHCM,400000,4.8,10.7810,106.7020,"TPHCM, Nhật Bản, Sushi, Cá sống Tươi, Sang trọng Hẹn hò"
14,Lẩu Bò Tí Chuột,21 Cống Quỳnh - Quận 1,TPHCM,120000,4.1,10.7550,106.6650,"TPHCM, Miền Nam, Lẩu, Bò Nấm, Vỉa hè Nhậu Đêm"
15,Hủ Tiếu Nam Vang (Quỳnh),A65 Nguyễn Trãi - Quận 1,TPHCM,50000,4.3,10.7600,106.6850,"TPHCM, Miền Nam, Hủ tiếu, Tôm Thịt bằm, Truyền thống Đêm"
16,Gogi House (K-BBQ),303 Hai Bà Trưng - Quận 3,TPHCM,300000,4.5,10.7750,106.6680,"TPHCM, Hàn Quốc, Đồ nướng, Bò Kim chi, Buffet Gia đình"
17,Bánh Mì Huỳnh Hoa,26 Lê Thị Riêng - Quận 1,TPHCM,65000,4.4,10.7715,106.6930,"TPHCM, Miền Nam, Bánh mì, Pate Thịt nguội, Mang đi Xếp hàng"
18,The Coffee House,183 Trần Quốc Thảo - Quận 3,TPHCM,50000,4.2,10.7790,106.6900,"TPHCM, Á, Cafe, Trà Cà phê Sữa, Yên tĩnh Làm việc"
19,Chè Thái Ý Phương,380 Nguyễn Tri Phương - Quận 10,TPHCM,30000,4.3,10.7650,106.6670,"TPHCM, Thái Lan, Chè thái, Sầu riêng Ngọt, Ăn vặt Đêm"
20,Cục Gạch Quán,10 Đặng Tất - Quận 1,TPHCM,300000,4.6,10.7920,106.6850,"TPHCM, Việt Nam, Cơm việt, Canh chua Cá kho, Sang trọng Truyền thống"
21,Lẩu Dê 404,9 Nguyễn Văn Linh - Quận 7,TPHCM,130000,4.0,10.7620,106.7050,"TPHCM, Miền Nam, Lẩu dê, Dê Nướng, Nhậu Vỉa hè"
22,Bò Tơ Quán Mộc,486 Nguyễn Thị Thập - Quận 7,TPHCM,250000,4.2,10.8300,106.7500,"TPHCM, Việt Nam, Bò tơ, Nướng Cuốn, Gia đình Rộng rãi"
23,Phá Lấu Bò Cô Thảo,243/29G Tôn Đản - Quận 4,TPHCM,30000,4.4,10.7610,106.7040,"TPHCM, Miền Nam, Phá lấu, Bò Nước cốt dừa, Ăn vặt Vỉa hè"
24,El Gaucho Steakhouse,74 Hai Bà Trưng - Quận 1,TPHCM,1500000,4.8,10.7820,106.7050,"TPHCM, Âu, Steak, Bò Rượu vang, Sang trọng Hẹn hò"
25,Kichi-Kichi Lẩu Băng Chuyền,SC VivoCity - Quận 7,TPHCM,280000,4.1,10.7310,106.7110,"TPHCM, Á, Lẩu, Bò Nấm Hải sản, Buffet Băng chuyền"
26,Cơm Gà Xối Mỡ 007,007 Lô F Chung Cư Bàu Cát - Tân Bình,TPHCM,45000,4.0,10.7520,106.6700,"TPHCM, Trung Hoa, Cơm gà, Gà chiên Xối mỡ, Bình dân Nhanh"
27,Ramen Tomidaya,8A/1C1 Thái Văn Lung - Quận 1,TPHCM,90000,4.6,10.8000,106.7100,"TPHCM, Nhật Bản, Ramen, Mì Trứng, Nhỏ Ấm cúng"
28,Dimsum (Tiến Phát),18 Ký Hòa - Quận 5,TPHCM,70000,4.4,10.7500,106.6500,"TPHCM, Trung Hoa, Dimsum, Há cảo Xíu mại, Sáng Điểm tâm"
29,Haidilao Hotpot,Bitexco Tower - Quận 1,TPHCM,400000,4.9,10.7770,106.7010,"TPHCM, Trung Hoa, Lẩu, Bò Cay Tứ Xuyên, Dịch vụ tốt Sang trọng"
30,Gong Cha (Trà Sữa),143 Tôn Thất Đạm - Quận 1,TPHCM,55000,4.3,10.7760,106.7000,"TPHCM, Đài Loan, Trà sữa, Trân châu Ngọt, Mang đi Chuỗi"
31,Bánh Canh Cua (Hoàng Lan),484 Vĩnh Viễn - Quận 10,TPHCM,45000,4.5,10.7950,106.6900,"TPHCM, Miền Nam, Bánh canh, Cua Ghẹ Sệt, Bình dân Đông đúc"
32,Mì Ý (Pasta Fresca),28 Thảo Điền - Quận 2,TPHCM,150000,4.6,10.8050,106.7350,"TPHCM, Âu, Mì ý, Pasta Phô mai, Sân vườn Hẹn hò"
33,BiaCraft Artisan Ales,1 Lê Ngô Cát - Quận 3,TPHCM,120000,4.5,10.7800,106.6880,"TPHCM, Âu, Bia thủ công, Đồ tây Nhắm, Nhậu Bạn bè"
34,Chả Cá Lã Vọng (Chi nhánh HCM),36 Tôn Thất Tùng - Quận 1,TPHCM,180000,4.3,10.7850,106.6950,"TPHCM, Miền Bắc, Chả cá, Cá Lăng Mắm tôm, Truyền thống Gia đình"
35,Bingsu (Sul BING),219 Nguyễn Trãi - Quận 1,TPHCM,80000,4.4,10.7910,106.6800,"TPHCM, Hàn Quốc, Bingsu, Đá bào Trái cây, Tráng miệng Mát"
36,Xôi Gà (Bà Chiểu),318/1 Bùi Hữu Nghĩa - Bình Thạnh,TPHCM,25000,4.2,10.8010,106.6980,"TPHCM, Miền Nam, Xôi, Gà Xá xíu, Đêm Vỉa hè Mang đi"
37,D'Maris Buffet,Lotte Mart - Quận 7,TPHCM,700000,4.5,10.7350,106.7150,"TPHCM, Quốc Tế, Buffet, Hải sản Sushi Steak, Sang trọng Tiệc"
38,Cà Phê Trứng (Phinholic),113 Nguyễn Huệ - Quận 1,TPHCM,45000,4.1,10.7930,106.6820,"TPHCM, Việt Nam, Cafe trứng, Trứng Sữa, Yên tĩnh Ngắm cảnh"
39,Bánh Tráng Trảng Bàng (Hoàng Ty),74 Trương Quốc Dung - Phú Nhuận,TPHCM,100000,4.0,10.7780,106.6850,"TPHCM, Miền Nam, Bánh tráng, Thịt luộc Rau rừng, Gia đình Cuốn"
40,Bò Né (Lệ Hồng),489/21/35 Huỳnh Văn Bánh - Phú Nhuận,TPHCM,50000,4.2,10.7700,106.6650,"TPHCM, Miền Nam, Bò né, Bò Trứng Pate, Sáng Bình dân"
41,King Roti,34 Hồ Tùng Mậu - Quận 1,TPHCM,15000,4.3,10.7735,106.7020,"TPHCM, Á, Bánh ngọt, Bơ Cà phê, Ăn vặt Mang đi"
42,Lẩu Mắm (Bà Dú),19 Cao Thắng - Quận 3,TPHCM,180000,4.1,10.7740,106.6920,"TPHCM, Miền Tây, Lẩu mắm, Cá Kèo Rau, Truyền thống Gia đình"
43,Kem Bạch Đằng,28 Lê Lợi - Quận 1,TPHCM,60000,3.8,10.7750,106.7015,"TPHCM, Việt Nam, Kem, Trái cây Dừa, Truyền thống Lâu đời"
44,Ba Rọi Nướng (Panda BBQ),157 Nguyễn Tri Phương - Quận 5,TPHCM,40000,4.0,10.7680,106.6600,"TPHCM, Á, Xiên nướng, Ba rọi Bò, Vỉa hè Nhậu Sinh viên"
45,Cơm Niêu (Sài Gòn),27 Tú Xương - Quận 3,TPHCM,120000,4.3,10.7820,106.6890,"TPHCM, Việt Nam, Cơm niêu, Cá kho Tộ, Gia đình Truyền thống"
46,Cà Phê Vợt (Phan Đình Phùng),330 Phan Đình Phùng - Phú Nhuận,TPHCM,18000,4.5,10.7940,106.6830,"TPHCM, Việt Nam, Cafe vợt, Sữa đá, Vỉa hè Đêm Truyền thống"
47,42nd Scroll (Tráng miệng),42 Trần Cao Vân - Quận 3,TPHCM,90000,4.6,10.7765,106.6990,"TPHCM, Âu, Bánh ngọt, Trà Bánh, Hẹn hò Lãng mạn"
48,Gà Nướng Cơm Lam (Gà Mẹt),15 Trần Quốc Toản - Quận 3,TPHCM,200000,4.2,10.8400,106.7600,"TPHCM, Tây Nguyên, Gà nướng, Cơm lam Gà ta, Gia đình Hội nhóm"
49,Đậu Hũ (Orisoy),53 Thống Nhất - Thủ Đức,TPHCM,25000,4.1,10.7710,106.6720,"TPHCM, Á, Đậu hũ, Trân châu Đường đen, Ăn vặt Tráng miệng"
50,Hotpot Story,Vạn Hạnh Mall - Quận 10,TPHCM,250000,3.9,10.7800,106.7000,"TPHCM, Á, Lẩu, Buffet Bò Hải sản, Chuỗi Gia đình"
51,Cơm Gà (Trần Ký),144 Ký Con - Quận 1,TPHCM,60000,4.1,10.7540,106.6680,"TPHCM, Trung Hoa, Cơm gà, Gà xối mỡ, Bình dân Trưa"
52,Bò 7 Món (Ánh Hồng),71 Nguyễn Thái Bình - Quận 1,TPHCM,300000,4.3,10.7620,106.6820,"TPHCM, Miền Nam, Bò 7 món, Bò Cuốn, Gia đình Tiệc"
53,Phở Lệ,413 Nguyễn Trãi - Quận 5,TPHCM,65000,4.4,10.7580,106.6750,"TPHCM, Miền Nam, Phở, Bò viên Gầu, Truyền thống Béo"
54,Bánh Cuốn (Tây Hồ),127 Đinh Tiên Hoàng - Quận 1,TPHCM,50000,4.0,10.7900,106.6950,"TPHCM, Miền Bắc, Bánh cuốn, Chả lụa Nem, Sáng Nhẹ nhàng"
55,Lẩu Nấm (Ashima),35A Nguyễn Đình Chiểu - Quận 1,TPHCM,350000,4.5,10.7795,106.6870,"TPHCM, Á, Lẩu nấm, Nấm thiên nhiên, Sang trọng Sức khỏe"
56,Cháo Sườn (Chú Chen),281 Nguyễn Trãi - Quận 1,TPHCM,40000,4.2,10.7730,106.6940,"TPHCM, Trung Hoa, Cháo sườn, Sườn gan, Ăn vặt Đêm"
57,Highlands Coffee,Diamond Plaza - Quận 1,TPHCM,45000,4.0,10.7830,106.6960,"TPHCM, Việt Nam, Cafe, Phin Sữa đá, Chuỗi Làm việc"
58,Mì Vằn Thắn (Hòa Mã),50 Cao Thắng - Quận 3,TPHCM,45000,4.1,10.7750,106.6810,"TPHCM, Trung Hoa, Mì vằn thắn, Sủi cảo Xá xíu, Sáng Nước"
59,Vịt Quay (Phát Thành),524 Phan Văn Trị - Gò Vấp,TPHCM,200000,4.4,10.7510,106.6620,"TPHCM, Trung Hoa, Vịt quay, Vịt Bánh bao, Mang đi Gia đình"
60,Bánh Bột Lọc (Bà Nội),178/4 Phan Đăng Lưu - Phú Nhuận,TPHCM,30000,4.5,10.7960,106.6800,"TPHCM, Miền Trung, Bánh bột lọc, Tôm thịt Mắm, Ăn vặt Vỉa hè"
61,Mì Cay (Sasin),157 Nguyễn Gia Trí - Bình Thạnh,TPHCM,60000,4.0,10.7720,106.6690,"TPHCM, Hàn Quốc, Mì cay, Hải sản Bò 7 cấp độ, Sinh viên"
62,Bò Kho (Út Nhung),109 Nguyễn Thiện Thuật - Quận 3,TPHCM,50000,4.2,10.7850,106.6840,"TPHCM, Miền Nam, Bò kho, Bánh mì Hủ tiếu, Sáng Đậm đà"
63,Bún Mắm (Chị I),22 Phan Bội Châu - Quận 1,TPHCM,60000,4.3,10.7770,106.6980,"TPHCM, Miền Tây, Bún mắm, Cá Tôm Mực, Đậm đà Dân dã"
64,Starbucks,76 Lê Lai - Quận 1,TPHCM,80000,4.2,10.7755,106.7010,"TPHCM, Mỹ, Cafe, Frappuccino, Sang trọng Làm việc"
65,Cơm Chay (Thiện Duyên),505 Xô Viết Nghệ Tĩnh - Bình Thạnh,TPHCM,30000,4.4,10.7680,106.6630,"TPHCM, Á, Cơm chay, Rau củ Đậu, Bình dân Trưa"
66,Bánh Tráng Nướng (Phan Rang),123 Lê Lợi - Quận 1,TPHCM,20000,4.1,10.7785,106.6890,"TPHCM, Miền Trung, Bánh tráng nướng, Trứng Mắm ruốc, Ăn vặt Vỉa hè"
67,Nem Nướng (Nha Trang),400 Hai Bà Trưng - Quận 3,TPHCM,50000,4.3,10.7980,106.6780,"TPHCM, Miền Trung, Nem nướng, Cuốn Rau sống, Gia đình Bạn bè"
68,Cơm Văn Phòng (ABC),123 Nguyễn Huệ - Quận 1,TPHCM,45000,3.8,10.7810,106.6930,"TPHCM, Việt Nam, Cơm trưa, Thịt kho Canh, Văn phòng Nhanh"
69,Lẩu Cá Kèo (Bà Huyện),10 Sư Thiện Chiếu - Quận 3,TPHCM,150000,4.2,10.7790,106.6860,"TPHCM, Miền Tây, Lẩu cá kèo, Cá Lá giang, Nhậu Chua"
70,Pé Pâ (Bánh ngọt),118 Nguyễn Thị Minh Khai - Quận 3,TPHCM,70000,4.6,10.7745,106.6995,"TPHCM, Âu, Bánh ngọt, Tiramisu Cheese, Hẹn hò Cafe"
71,Bún Riêu (Gánh),4 Phan Bội Châu - Quận 1,TPHCM,55000,4.1,10.7730,106.7030,"TPHCM, Miền Nam, Bún riêu, Cua Ốc Huyết, Chợ Bến Thành"
72,Xôi Bắp (Ngô Quyền),109 Ngô Quyền - Quận 5,TPHCM,15000,4.4,10.7650,106.6700,"TPHCM, Việt Nam, Xôi bắp, Đậu xanh Hành phi, Sáng Mang đi"
73,Mì Vịt Tiềm,481 Nguyễn Tri Phương - Quận 10,TPHCM,70000,4.2,10.7560,106.6650,"TPHCM, Trung Hoa, Mì vịt tiềm, Vịt Thuốc bắc, Bổ dưỡng Đêm"
74,Hủ tiếu Mực (Ông Già),62 Tôn Thất Thiệp - Quận 1,TPHCM,45000,4.1,10.7700,106.6620,"TPHCM, Miền Nam, Hủ tiếu mực, Mực Tôm Thịt bằm, Sáng Trưa"
75,Don Chicken,25 Hồ Tùng Mậu - Quận 1,TPHCM,180000,4.3,10.7320,106.7080,"TPHCM, Hàn Quốc, Gà rán, Gà nướng Phô mai, Bạn bè Chuỗi"
76,Phở Thìn (Lò Đúc),13 Lò Đúc - Hai Bà Trưng,Hà Nội,60000,4.5,21.0170,105.8550,"Hà Nội, Miền Bắc, Phở, Bò Tái lăn, Truyền thống Nổi tiếng"
77,Bún Chả Hàng Mành (Đắc Kim),1 Hàng Mành - Hoàn Kiếm,Hà Nội,60000,4.3,21.0290,105.8480,"Hà Nội, Miền Bắc, Bún chả, Thịt nướng Nem, Truyền thống Trưa"
78,Chả Cá Lã Vọng (Chính gốc),14 Chả Cá - Hoàn Kiếm,Hà Nội,150000,4.2,21.0350,105.8450,"Hà Nội, Miền Bắc, Chả cá, Cá lăng Mắm tôm, Đặc sản Gia đình"
79,Cà Phê Giảng (Cafe Trứng),39 Nguyễn Hữu Huân - Hoàn Kiếm,Hà Nội,35000,4.6,21.0330,105.8510,"Hà Nội, Việt Nam, Cafe trứng, Trứng Sữa, Truyền thống Yên tĩnh"
80,Bánh Tôm Hồ Tây,1 Thanh Niên - Tây Hồ,Hà Nội,50000,4.1,21.0480,105.8380,"Hà Nội, Miền Bắc, Bánh tôm, Tôm Chiên giòn, View hồ Ăn vặt"
81,Phở Bò (Bát Đàn),49 Bát Đàn - Hoàn Kiếm,Hà Nội,55000,4.7,21.0320,105.8470,"Hà Nội, Miền Bắc, Phở bò, Bò Tái chín, Xếp hàng Truyền thống"
82,Bún Đậu (Ngõ Trạm),1B Ngõ Trạm - Hoàn Kiếm,Hà Nội,40000,4.2,21.0300,105.8460,"Hà Nội, Miền Bắc, Bún đậu, Mắm tôm Thịt luộc, Vỉa hè Bình dân"
83,Kem Tràng Tiền,35 Tràng Tiền - Hoàn Kiếm,Hà Nội,12000,4.5,21.0250,105.8560,"Hà Nội, Việt Nam, Kem, Đậu xanh Cốm, Ăn vặt Mang đi"
84,Bánh Cuốn (Bà Hoành),66 Tô Hiến Thành - Hai Bà Trưng,Hà Nội,35000,4.3,21.0150,105.8520,"Hà Nội, Miền Bắc, Bánh cuốn, Chả quế Thanh trì, Sáng Nhẹ nhàng"
85,Xôi Yến,35B Nguyễn Hữu Huân - Hoàn Kiếm,Hà Nội,40000,4.0,21.0340,105.8500,"Hà Nội, Miền Bắc, Xôi, Gà Pate Trứng, Nhanh Đêm"
86,Bia Hơi (Hải Xồm),86 Lê Trọng Tấn - Thanh Xuân,Hà Nội,80000,4.1,21.0380,105.7950,"Hà Nội, Việt Nam, Bia hơi, Mồi Nhậu, Vỉa hè Bạn bè"
87,Lẩu Ếch (Phó Đức Chính),5 Phó Đức Chính - Ba Đình,Hà Nội,200000,4.2,21.0450,105.8420,"Hà Nội, Miền Bắc, Lẩu ếch, Ếch Măng cay, Nhậu Vỉa hè"
88,Miến Lươn (Đồng),87 Hàng Điếu - Hoàn Kiếm,Hà Nội,45000,4.3,21.0310,105.8490,"Hà Nội, Miền Bắc, Miến lươn, Lươn giòn Nước, Sáng Truyền thống"
89,Bánh Mì (Phố Cổ),38 Đinh Liệt - Hoàn Kiếm,Hà Nội,30000,4.4,21.0305,105.8520,"Hà Nội, Miền Bắc, Bánh mì, Pate Truyền thống, Mang đi Du lịch"
90,Nộm Bò Khô (Hàm Long),23 Hàm Long - Hoàn Kiếm,Hà Nội,35000,4.2,21.0220,105.8540,"Hà Nội, Miền Bắc, Nộm bò, Bò khô Đu đủ, Ăn vặt Vỉa hè"
91,Bún Thang (Cầu Gỗ),48 Cầu Gỗ - Hoàn Kiếm,Hà Nội,40000,4.1,21.0335,105.8530,"Hà Nội, Miền Bắc, Bún thang, Gà Trứng Giò, Tinh tế Sáng"
92,Pizza (Capricciosa),Vincom Bà Triệu - Hai Bà Trưng,Hà Nội,220000,4.5,21.0210,105.8510,"Hà Nội, Ý, Pizza, Pasta Phô mai, Gia đình Hẹn hò"
93,Cháo Trai (Trần Xuân Soạn),26 Trần Xuân Soạn - Hai Bà Trưng,Hà Nội,30000,4.3,21.0180,105.8550,"Hà Nội, Miền Bắc, Cháo trai, Trai Quẩy, Sáng Chiều Vỉa hè"
94,Lẩu Riêu Cua (Bà Sáu),19 Hàng Lược - Hoàn Kiếm,Hà Nội,250000,4.2,21.0370,105.8350,"Hà Nội, Miền Bắc, Lẩu riêu, Cua Bò sườn, Gia đình Nhậu"
95,Phở Gà (Nguyệt),5 Phủ Doãn - Hoàn Kiếm,Hà Nội,50000,4.4,21.0280,105.8430,"Hà Nội, Miền Bắc, Phở gà, Gà ta Trộn, Đêm Đông đúc"
96,Nem Chua Nướng (Ấu Triệu),10 Ấu Triệu - Hoàn Kiếm,Hà Nội,6000,4.5,21.0295,105.8495,"Hà Nội, Miền Bắc, Nem chua, Nướng Than hoa, Ăn vặt Ngõ"
97,Bánh Gối (Lý Quốc Sư),52 Lý Quốc Sư - Hoàn Kiếm,Hà Nội,20000,4.2,21.0300,105.8490,"Hà Nội, Miền Bắc, Bánh gối, Thịt Trứng cút, Chiên Ăn vặt"
98,Cafe Đinh,13 Đinh Tiên Hoàng - Hoàn Kiếm,Hà Nội,30000,4.6,21.0325,105.8535,"Hà Nội, Việt Nam, Cafe trứng, Trứng Ca cao, Cổ kính View hồ"
99,Bò Nhúng Dấm (555),52 Trung Hòa - Cầu Giấy,Hà Nội,150000,4.1,21.0360,105.8300,"Hà Nội, Việt Nam, Lẩu bò, Bò Nhúng dấm, Chuỗi Gia đình"
100,Vịt Cỏ (Vân Đình),Hà Đông,Hà Nội,120000,4.3,20.9950,105.8050,"Hà Nội, Miền Bắc, Vịt cỏ, Nướng Luộc Tiết canh, Nhậu Dân dã"
101,Bún Ốc (Cô Huệ),43 Nguyễn Siêu - Hoàn Kiếm,Hà Nội,40000,4.2,21.0190,105.8560,"Hà Nội, Miền Bắc, Bún ốc, Ốc Nguội Chua thanh, Cổ truyền Sáng"
102,Tào Phớ (Nghĩa Tân),106C2 Nghĩa Tân - Cầu Giấy,Hà Nội,10000,4.4,21.0420,105.7920,"Hà Nội, Việt Nam, Tào phớ, Thạch Trân châu, Giải khát Rẻ"
103,Bánh Đa Cua (Hàng Bạc),14 Hàng Bạc - Hoàn Kiếm,Hà Nội,35000,4.1,21.0330,105.8525,"Hà Nội, Miền Bắc, Bánh đa, Cua Rau cần, Trưa Nhanh"
104,Bánh Giò (Đông Các),33 Đông Các - Đống Đa,Hà Nội,15000,4.3,21.0200,105.8250,"Hà Nội, Miền Bắc, Bánh giò, Thịt Xúc xích, Chiều Nóng"
105,Bánh Mì Chảo (Thái Thịnh),35 Thái Thịnh - Đống Đa,Hà Nội,50000,4.2,21.0080,105.8200,"Hà Nội, Việt Nam, Bánh mì chảo, Pate Trứng Bò, Sốt vang Học sinh"
106,Bò Bít Tết (Hòe Nhai),3 Hòe Nhai - Ba Đình,Hà Nội,80000,4.1,21.0400,105.8450,"Hà Nội, Âu, Bít tết, Bò Khoai chiên, Bình dân Vỉa hè"
107,Lẩu Nướng (Gật Gù),134 Nguyễn Khánh Toàn - Cầu Giấy,Hà Nội,150000,4.0,21.0550,105.8300,"Hà Nội, Á, Buffet, Lẩu Nướng, Sinh viên Rẻ"
108,Bún Cá (Sâm Cây Si),5 Ngõ Trung Yên - Hoàn Kiếm,Hà Nội,40000,4.3,21.0315,105.8485,"Hà Nội, Miền Bắc, Bún cá, Cá giòn Chả cá, Ngõ Trưa"
109,Cà Phê (Cộng),27 Nhà Thờ - Hoàn Kiếm,Hà Nội,50000,4.5,21.0300,105.8500,"Hà Nội, Việt Nam, Cafe, Cốt dừa Cốm, Bao cấp Checkin"
110,Bánh Tráng Cuốn Thịt Heo (Hoàng Bèo),40 Duy Tân - Cầu Giấy,Hà Nội,80000,4.2,21.0150,105.8350,"Hà Nội, Miền Trung, Bánh tráng cuốn, Thịt heo Mắm nêm, Chuỗi Văn phòng"
111,Gà Tần (Mai Hương),12 Hàng Cót - Hoàn Kiếm,Hà Nội,50000,4.3,21.0050,105.8510,"Hà Nội, Miền Bắc, Gà tần, Thuốc bắc Ngải cứu, Bổ dưỡng Đêm"
112,Chân Gà Nướng (Mỹ Miều),Phạm Ngọc Thạch - Đống Đa,Hà Nội,10000,4.1,21.0100,105.8300,"Hà Nội, Việt Nam, Chân gà, Nướng Mật ong, Nhậu Đêm"
113,Bún Ngan (Nhàn),14 Ngõ Trung Yên - Hoàn Kiếm,Hà Nội,45000,4.4,21.0310,105.8460,"Hà Nội, Miền Bắc, Bún ngan, Ngan Măng, Trưa Xếp hàng"
114,Quẩy Nóng (Hàng Bông),73 Hàng Bông - Hoàn Kiếm,Hà Nội,5000,4.2,21.0290,105.8475,"Hà Nội, Việt Nam, Quẩy, Chiên Nóng, Ăn vặt Mùa đông"
115,Trà Chanh (Nhà Thờ),Khu Nhà Thờ Lớn - Hoàn Kiếm,Hà Nội,20000,4.5,21.0285,105.8495,"Hà Nội, Việt Nam, Trà chanh, Hướng dương, Vỉa hè Chém gió"
116,Phở Xào (Bát Đàn),32 Bát Đàn - Hoàn Kiếm,Hà Nội,60000,4.3,21.0320,105.8470,"Hà Nội, Miền Bắc, Phở xào, Bò Rau cải, Tối Săn chắc"
117,Bánh Khúc (Cô Lan),69B Nguyễn Công Trứ - Hai Bà Trưng,Hà Nội,15000,4.4,21.0180,105.8540,"Hà Nội, Miền Bắc, Bánh khúc, Xôi Đỗ xanh, Sáng Đêm Mang đi"
118,Lẩu Thái (Coca Suki),75 Láng Hạ - Đống Đa,Hà Nội,300000,4.5,21.0320,105.8280,"Hà Nội, Thái Lan, Lẩu thái, Tomyum Hải sản, Sang trọng Chuỗi"
119,Mì Gà Tần (Cây Táo),23 Hàng Cân - Hoàn Kiếm,Hà Nội,50000,4.2,21.0350,105.8480,"Hà Nội, Miền Bắc, Mì gà tần, Thuốc bắc, Ăn khuya"
120,Bún Bò Nam Bộ (Bách Phương),67 Hàng Điếu - Hoàn Kiếm,Hà Nội,60000,4.6,21.0310,105.8505,"Hà Nội, Miền Nam, Bún bò trộn, Lạc Hành phi, Chua ngọt Khách tây"
121,Chè (Bốn Mùa),4 Hàng Cân - Hoàn Kiếm,Hà Nội,25000,4.4,21.0345,105.8520,"Hà Nội, Miền Bắc, Chè, Sen Đỗ đen, Truyền thống Mát"
122,Gà Không Lối Thoát (Hương Việt),88 Ngô Thì Nhậm - Hai Bà Trưng,Hà Nội,250000,4.3,21.0400,105.7850,"Hà Nội, Việt Nam, Gà bọc xôi, Gà nướng Chiên, Gia đình Lạ"
123,King BBQ,Royal City - Thanh Xuân,Hà Nội,300000,4.4,21.0280,105.8250,"Hà Nội, Hàn Quốc, Nướng, Bò Mỹ Buffet, TTTM Gia đình"
124,Dimsum (Long Đình),64B Quán Sứ - Hoàn Kiếm,Hà Nội,350000,4.7,21.0250,105.8530,"Hà Nội, Trung Hoa, Dimsum, Vịt quay, Sang trọng Tiếp khách"
125,Bánh Đúc Nóng (Trung Tự),116C2 Trung Tự - Đống Đa,Hà Nội,15000,4.3,21.0080,105.8320,"Hà Nội, Miền Bắc, Bánh đúc nóng, Thịt băm Mộc nhĩ, Chiều Đông"
126,Nem Lụi (Huế),Phan Huy Ích - Ba Đình,Hà Nội,40000,4.1,21.0160,105.8280,"Hà Nội, Miền Trung, Nem lụi, Nướng Cuốn, Ăn vặt"
127,Bò Nướng (Xuân Xuân),47 Mã Mây - Hoàn Kiếm,Hà Nội,100000,4.0,21.0340,105.8500,"Hà Nội, Việt Nam, Bò nướng, Nầm nướng Giấy bạc, Vỉa hè Khói"
128,Ốc (Trang),Đinh Liệt - Hoàn Kiếm,Hà Nội,100000,4.2,21.0220,105.8400,"Hà Nội, Miền Bắc, Ốc, Luộc Xào me, Vỉa hè Đắt khách"
129,Bún Dọc Mùng (Bát Đàn),18 Bát Đàn - Hoàn Kiếm,Hà Nội,35000,4.1,21.0320,105.8470,"Hà Nội, Miền Bắc, Bún dọc mùng, Mọc Thịt chân giò, Sáng Thanh đạm"
130,Manwah (Lẩu Đài Loan),Lotte Center - Ba Đình,Hà Nội,350000,4.6,21.0380,105.7950,"Hà Nội, Đài Loan, Lẩu, Buffet Mala, Sang trọng Dịch vụ"
131,Mỳ Vằn Thắn (Số 9 Đinh Liệt),9 Đinh Liệt - Hoàn Kiếm,Hà Nội,40000,4.4,21.0330,105.8530,"Hà Nội, Trung Hoa, Mì vằn thắn, Sủi cảo Gan, Phố cổ"
132,Chè Sầu (Chè Chang Hi),100 Xã Đàn - Đống Đa,Hà Nội,35000,4.3,21.0150,105.8300,"Hà Nội, Miền Nam, Chè sầu, Sầu riêng Đà Nẵng, Ngọt Béo"
133,Bánh Mì (Nguyên Sinh),17 Lý Quốc Sư - Hoàn Kiếm,Hà Nội,80000,4.2,21.0310,105.8495,"Hà Nội, Âu, Bánh mì chảo, Pate Gan ngỗng, Sang chảnh Lâu đời"
134,Bia Hải Hói,123 Nguyễn Khánh Toàn - Cầu Giấy,Hà Nội,100000,4.0,21.0420,105.8200,"Hà Nội, Việt Nam, Bia hơi, Nhậu Mồi, Ồn ào Bình dân"
135,Cafe (Giảng 2),106 Yên Phụ - Tây Hồ,Hà Nội,35000,4.5,21.0330,105.8510,"Hà Nội, Việt Nam, Cafe trứng, Yên Phụ, View đường"
136,Lẩu Cháo (Quán Sứ),63 Quán Sứ - Hoàn Kiếm,Hà Nội,150000,4.1,21.0250,105.8450,"Hà Nội, Miền Bắc, Lẩu cháo, Chim Bồ câu, Đêm Ấm"
137,Cơm Rang Dưa Bò (Mã Mây),47 Mã Mây - Hoàn Kiếm,Hà Nội,50000,4.2,21.0350,105.8520,"Hà Nội, Việt Nam, Cơm rang, Dưa bò, Phố cổ No"
138,Bún Bò Huế (Hàng Bún),34 Hàng Bún - Ba Đình,Hà Nội,45000,4.0,21.0400,105.8420,"Hà Nội, Miền Trung, Bún bò huế, Giò heo, Cay"
139,Bánh Đa Trộn (Hàng Chĩnh),17 Hàng Chĩnh - Hoàn Kiếm,Hà Nội,30000,4.3,21.0370,105.8530,"Hà Nội, Miền Bắc, Bánh đa trộn, Cua Giò, Ăn vặt Trưa"
140,Nướng (Lụa),68 Đê La Thành - Đống Đa,Hà Nội,180000,4.1,21.0480,105.8350,"Hà Nội, Việt Nam, Nướng, Bò nầm, Vỉa hè Đông đúc"
141,Cơm Sườn (Đào Duy Từ),47 Đào Duy Từ - Hoàn Kiếm,Hà Nội,40000,4.2,21.0340,105.8510,"Hà Nội, Việt Nam, Cơm sườn, Sườn nướng, Trưa Văn phòng"
142,Kem (Xôi),8 Hai Bà Trưng - Hoàn Kiếm,Hà Nội,20000,4.4,21.0150,105.8500,"Hà Nội, Việt Nam, Kem xôi, Dừa khô, Ăn vặt Mùa hè"
143,Bánh Tráng Trộn (Hàng Trống),86 Hàng Trống - Hoàn Kiếm,Hà Nội,25000,4.3,21.0300,105.8490,"Hà Nội, Miền Nam, Bánh tráng trộn, Xoài Bò khô, Vỉa hè Cay"
144,Bún Đậu (Hàng Khay),31 Hàng Khay - Hoàn Kiếm,Hà Nội,50000,4.5,21.0260,105.8530,"Hà Nội, Miền Bắc, Bún đậu, Mắm tôm Chả cốm, Ngõ Hẹp Đông"
145,Bò Nầm Nướng (Cầu Gỗ),45 Cầu Gỗ - Hoàn Kiếm,Hà Nội,120000,4.1,21.0330,105.8530,"Hà Nội, Việt Nam, Nầm bò nướng, Vỉa hè, Nhậu Đêm View hồ"
146,Lẩu Gà (Cáo),125 Nguyễn Chí Thanh - Đống Đa,Hà Nội,200000,4.3,21.0180,105.8300,"Hà Nội, Miền Bắc, Lẩu gà, Lá é Thuốc bắc, Hội nhóm"
147,Nem Rán (Hàng Bè),21 Hàng Bè - Hoàn Kiếm,Hà Nội,5000,4.4,21.0320,105.8520,"Hà Nội, Miền Bắc, Nem rán, Tạm thương, Ăn vặt Rẻ"
148,Bánh Cuốn (Gia An),105 Lò Đúc - Hai Bà Trưng,Hà Nội,40000,4.1,21.0150,105.8510,"Hà Nội, Miền Bắc, Bánh cuốn, Chả mực, Chuỗi Sạch sẽ"
149,Phở Cuốn (Hưng Bền),33 Ngũ Xã - Ba Đình,Hà Nội,60000,4.3,21.0450,105.8400,"Hà Nội, Miền Bắc, Phở cuốn, Phở chiên phồng, Ngũ Xã Nhậu"
150,Chè (Tự Do),80 Quán Thánh - Ba Đình,Hà Nội,30000,4.2,21.0400,105.8350,"Hà Nội, Việt Nam, Chè, Cốm Khoai môn, Cổ truyền"
151,Phở Hòa Pasteur,260C Pasteur - Quận 3,TPHCM,90000,4.5,10.7825,106.6890,"TPHCM, Miền Nam, Phở, Bò Nạm Gầu, Truyền thống Nổi tiếng"
152,Phở Hùng,243 Nguyễn Trãi - Quận 1,TPHCM,75000,4.2,10.7650,106.6880,"TPHCM, Miền Nam, Phở, Bò Viên, Chuỗi Máy lạnh"
153,Phở Phú Vương,339 Lê Văn Sỹ - Tân Bình,TPHCM,65000,4.3,10.7990,106.6720,"TPHCM, Miền Nam, Phở, Bò Tái Nạm, Đậm đà"
154,Phở Minh,63/6 Pasteur - Quận 1,TPHCM,80000,4.4,10.7750,106.7010,"TPHCM, Miền Bắc, Phở, Bò Tái, Hẻm Yên tĩnh"
155,Phở Cao Vân,25 Mạc Đĩnh Chi - Quận 1,TPHCM,70000,4.6,10.7850,106.7000,"TPHCM, Miền Bắc, Phở, Bò Chín, Lâu đời Cụ già"
156,Phở 10 Lý Quốc Sư,10 Lý Quốc Sư - Hoàn Kiếm,Hà Nội,80000,4.7,21.0300,105.8480,"Hà Nội, Miền Bắc, Phở, Bò Tái Chín, Nổi tiếng Xếp hàng"
157,Phở Sướng,24B Ngõ Trung Yên - Hoàn Kiếm,Hà Nội,60000,4.5,21.0320,105.8520,"Hà Nội, Miền Bắc, Phở, Bò Gầu, Ngõ Phố cổ"
